{
  "kitVersion": "1.3.1",
  "stack": "wordpress",
  "brand": "YOUR_BRAND",
  "siteDomain": "https://www.example.com",
  "language": "en-US",
  "contentRoot": "wp-content/themes/your-theme/content/",
  "publishPrefix": "/blog/",
  "contentRegistry": "wp-content/themes/your-theme/content-registry.json",
  "publishRoute": "wp-content/themes/your-theme/single-article.php",
  "primaryCta": "/#contact",
  "primaryServiceAnchor": "your primary service",
  "faqHeading": "FAQ",
  "linksSectionHeading": "Related links",
  "navSectionLabel": "Blog",
  "linkDenylist": [],
  "subjectManifest": "subject-manifest.json",
  "registryAdapter": "generic",
  "researchDir": "reserch/",
  "articleDraftDir": "reserch-based-articles/",
  "commandsDir": ".commends"
}
